{
  "schema_version": "2.3",
  "tree_revision_id": "eft_01J00000000000000000000005",
  "sequence": 2,
  "project_id": "efp_01J00000000000000000000001",
  "parent_tree_revision_id": "eft_01J00000000000000000000004",
  "created_at": "2026-07-15T12:10:00Z",
  "created_by_operation": "efo_01J00000000000000000000007",
  "source": "sync",
  "scope": {
    "root": ".",
    "include": [
      "**/*"
    ],
    "exclude": [
      ".expflow/**"
    ],
    "description": "Complete project tree"
  },
  "entries": [
    {
      "relative_path": "authorities/system-design/spec.md",
      "entry_kind": "file",
      "node_id": "efn_01J00000000000000000000002",
      "node_revision": 2,
      "external_locator": null,
      "folder_name": "system-design",
      "filename": "spec.md",
      "occupancy_status": "present",
      "node_content_digest": "sha256:2222222222222222222222222222222222222222222222222222222222222222"
    },
    {
      "relative_path": "references/prior-workflow.md",
      "entry_kind": "file",
      "node_id": "efn_01J00000000000000000000003",
      "node_revision": 1,
      "external_locator": null,
      "folder_name": "references",
      "filename": "prior-workflow.md",
      "occupancy_status": "historical",
      "node_content_digest": "sha256:3333333333333333333333333333333333333333333333333333333333333333"
    }
  ],
  "removed_paths": [
    "drafts/spec.md"
  ],
  "content_digest": "sha256:aaaaaaaaaaaaaaaaaaaaaaaaaaaaaaaaaaaaaaaaaaaaaaaaaaaaaaaaaaaaaaaa",
  "notes": "An explicit move preserved the specification lineage."
}
